{
  "schemaVersion":"1.0.0","id":"lexform-de-sprechen-spreche","lexemeId":"lex-de-sprechen","surface":"spreche","formType":"inflected","formTypeFa":"صرف‌شده","features":{"tense":"present","mood":"indicative","person":"1","number":"singular"},"featuresFa":{"tense":"حال","mood":"اخباری","person":"اول‌شخص","number":"مفرد"},"origin":"source_attested","originFa":"ثبت‌شده در منبع","reviewStatus":"approved","reviewStatusFa":"تأییدشده","sourceRefs":["src-wikibooks-bll-a1-lesson-1"],"notes":"در جملهٔ منبع‌دار «Ich spreche Englisch und Französisch.» به‌صورت اول‌شخص مفرد حال آمده است."
}
