{
  "schemaVersion":"1.0.0","id":"lexform-de-moegen-moechte","lexemeId":"lex-de-moegen","surface":"möchte","formType":"inflected","formTypeFa":"صرف‌شده","features":{"mood":"subjunctive_II","person":"1","number":"singular"},"featuresFa":{"mood":"التزامی دوم","person":"اول‌شخص","number":"مفرد"},"origin":"source_attested","originFa":"ثبت‌شده در منبع","reviewStatus":"approved","reviewStatusFa":"تأییدشده","sourceRefs":["src-wikibooks-de-lesson-007-food-order"],"notes":"در پاسخ‌های منبع‌دار سفارش، صورت اول‌شخص مفرد برای بیان خواسته به کار رفته است."
}
