{
  "schemaVersion":"1.0.0","id":"lexform-de-arbeiten-arbeite","lexemeId":"lex-de-arbeiten","surface":"arbeite","formType":"inflected","formTypeFa":"صرف‌شده","features":{"tense":"present","mood":"indicative","person":"1","number":"singular"},"featuresFa":{"tense":"حال","mood":"اخباری","person":"اول‌شخص","number":"مفرد"},"origin":"source_attested","originFa":"ثبت‌شده در منبع","reviewStatus":"approved","reviewStatusFa":"تأییدشده","sourceRefs":["src-wikibooks-bll-a1-lesson-1","src-wikibooks-bll-a1-lesson-2"],"notes":"در جمله‌های منبع‌دار معرفی شغل به‌صورت اول‌شخص مفرد حال آمده است."
}
