{
  "schemaVersion": "1.0.0",
  "id": "lexform-de-bleiben-bleibst",
  "lexemeId": "lex-de-bleiben",
  "surface": "bleibst",
  "formType": "inflected",
  "formTypeFa": "صرف‌شده",
  "features": {
    "tense": "present",
    "mood": "indicative",
    "person": "2",
    "number": "singular"
  },
  "featuresFa": {
    "tense": "حال",
    "mood": "اخباری",
    "person": "دوم‌شخص",
    "number": "مفرد"
  },
  "origin": "source_attested",
  "originFa": "ثبت‌شده در منبع",
  "reviewStatus": "approved",
  "reviewStatusFa": "تأییدشده",
  "sourceRefs": [
    "src-wikibooks-de-lesson-021-time-appointment"
  ],
  "notes": "این صورت صرفی عیناً در جملهٔ منبع‌دار این واحد آمده است."
}
