{
  "schemaVersion": "1.0.0",
  "id": "lexform-de-moegen-mag",
  "lexemeId": "lex-de-moegen",
  "surface": "mag",
  "formType": "inflected",
  "formTypeFa": "صرف‌شده",
  "features": {
    "tense": "present",
    "mood": "indicative",
    "person": [
      "1",
      "3"
    ],
    "number": "singular"
  },
  "featuresFa": {
    "tense": "حال",
    "mood": "اخباری",
    "person": [
      "اول‌شخص",
      "سوم‌شخص"
    ],
    "number": "مفرد"
  },
  "origin": "reference_attested",
  "originFa": "ثبت‌شده در مرجع",
  "reviewStatus": "approved",
  "reviewStatusFa": "تأییدشده",
  "sourceRefs": [
    "src-wiktionary-de-moegen"
  ],
  "notes": "در جملهٔ منبع‌دار «Ich mag Pizza.» به‌صورت اول‌شخص مفرد استفاده شده است."
}
